update_timestamp,title,news
2022-10-28 20:55:00,Letzte Chance: Foto-Special bei GIGA – 3 Vollversionen kostenlos zum Download,Nur noch heute bekommt ihr im Rahmen eines Foto-Specials bei GIGA drei normalerweise kostenpflichtige Windows-Vollversionen aus dem Themenbereich Foto gratis zum Download. Details zu den Programmen sowie die zugehörigen Downloadmöglichkeiten findet ihr im folgenden Artikel.
2022-10-28 18:15:00,MediaMarkt verrät: So viel spart ihr wirklich bei Rabattaktionen,"MediaMarkt veranstaltet regelmäßig Rabattaktionen mit oft ziemlich guten Preisen. Doch ihr müsst genau hinschauen, ob ihr wirklich ein Schnäppchen macht. Meist sind die Preise nämlich nur etwas günstiger als zuvor, obwohl ein höherer Rabatt suggeriert wird. Genau deswegen hat MediaMarkt jetzt eine Transparenz-Aktion gestartet, in der der zuletzt niedrigste Preis angezeigt wird. So erkennt ihr besser, ob das Angebot..."
2022-10-28 17:32:00,Aufatmen für Autokäufer? Trendwende bei Neuwagen deutet sich an,"Wer sich ein neues Auto zulegen will oder muss, hat keine gute Zeit erwischt. Die Preise klettern noch immer weiter, Sparer und Schnäppchenjäger müssen zusehen, wo sie bleiben. Doch inzwischen gibt es erste Anzeichen, dass sich der Wind bald drehen könnte."
2022-10-28 17:30:00,"Sky dreht an der Preisschraube: Kunden zahlen bis 9,99 Euro im Monat mehr","Jetzt wird auch noch Sky teurer: Bestandskunden, bei denen der Vertrag ausläuft, sollen bis zu 9,99 Euro mehr im Monat zahlen. Mehr Inhalte gibt es aber nicht zu sehen. Neukunden sind von der Preiserhöhung zunächst ausgenommen."
2022-10-28 17:25:00,"Sonos Super-Sale: Lautsprecher, Heimkino-Sets & Co. zum Sparpreis","Lautsprecher, Soundbars oder ganze Heimkino- und Entertainment-Sets – bei tink könnt ihr euch jetzt für kurze Zeit geniale Sound-Schnäppchen von Sonos sichern. Wir zeigen euch, welche Deals sich besonders lohnen und wie ihr on top noch extra sparen könnt."
2022-10-28 16:35:00,Schlappe für Xiaomi: Weg zur Smartphone-Krone wird länger,"Xiaomi hat sich zu einem der größten und wichtigsten Smartphone-Hersteller der Welt hochgearbeitet. Das chinesische Unternehmen möchte Samsung und Apple schlagen, um die Nummer eins zu werden. Das Ziel rückt aber in weite Ferne, denn die Verkaufszahlen sinken."
2022-10-28 16:30:00,Paywall bei Telegram: Für manche Beiträge sollt ihr jetzt zahlen,"Der Messenger Telegram experimentiert offenbar mit kostenpflichtigen Beiträgen. Erste Nutzer stehen bereits vor der neuen Bezahlschranke. Nur wer zahlt, bekommt Inhalte zu sehen. Telegram hat sich noch nicht offiziell geäußert, bislang handelt es sich nur um einen kleinen Test."
2022-10-28 15:30:00,Microsoft begräbt Hoffnung: Auf die Streaming-Xbox könnt ihr lange warten,"Zu früh gefreut: Nachdem Xbox-Chef Phil Spencer bereits mehr oder weniger versehentlich einen Prototyp gezeigt hatte, folgt jetzt der Dämpfer. Mit einer Xbox-Konsole für Streaming ist in nächster Zeit nicht zu rechnen, wie Spencer bestätigt. Am Projekt Keystone wird aber weiter gearbeitet."
2022-10-28 15:12:00,iPhone 15 ganz anders: Bei Apple rappelt es in der Kiste,"Schon jetzt wird ein spannendes Detail des iPhone 15 bekannt, auch wenn die neuen Apple-Handys erst im Herbst 2023 erwartet werden. Zumindest bei den beiden Pro-Modellen wird’s dann wortwörtlich ordentlich rappeln beziehungsweise vibrieren – aus gutem Grund."
2022-10-28 14:30:00,Elon Musk übernimmt Twitter: Bisherige Chefs fliegen raus,Der reichste Mensch der Welt hat Twitter endgültig für eine Kaufsumme von 44 Milliarden US-Dollar übernommen. In einem ersten Schritt hat sich Musk der Führungsetage entledigt. Sie sollen bereits aus dem Twitter-Hauptquartier eskortiert worden sein.
2022-10-28 13:30:00,Pixel-Handys von der Konkurrenz abgehängt – doch Google stört das nicht,In neueren Pixel-Smartphones lässt Google seinen eigenen Tensor-Prozess zum Einsatz kommen. In Benchmarks liegen die Handys hinter denen der Konkurrenz oft zurück – doch das ist laut Google überhaupt kein Problem. Ein anderes Thema sei viel wichtiger als die Spitzenleistung.
2022-10-28 13:19:00,Xbox Series X|S: Microsoft-Chef feiert großen Rekord,"Microsoft kann zufrieden sein. Auch wenn die Xbox Series X|S im direkten Konkurrenzkampf mit der PlayStation 5 hinterherhinkt, ist sie doch ein großer Erfolg. Auch die Vorgänger-Konsolen können da nicht mithalten."
2022-10-28 13:01:00,Samsung verrät: So erfolgreich ist das Galaxy S22 wirklich,"Das Samsung Galaxy S22 war im Vergleich zum Galaxy S21 nur ein kleines Upgrade – zumindest, wenn man das Galaxy S22 Ultra ausschließt. Letzteres wurde komplett neu entwickelt und übernimmt Fähigkeiten vom eingestellten Galaxy Note. Genau das soll auch das Erfolgsrezept von Samsung gewesen sein, wie das Unternehmen mit den Galaxy-S22-Handys mehr verdient hat als mit den Galaxy-S21-Modellen."
2022-10-28 12:52:00,Silent Hill: Alle Teile des Horrorspiel-Klassikers im Überblick,Mit dem ersten Teil revolutionierte die Reihe das Horror-Genre. Nun feiert sie ihre Rückkehr. Wir zeigen euch alle Silent-Hill-Spiele im Überblick.
2022-10-28 12:22:00,Wärmepumpe: So ermittelt ihr den Stromverbrauch,"Wärmepumpen sind eine Alternative, um das Haus und das Warmwasser zu beheizen. Wir zeigen, wir ihr den Stromverbrauch berechnet."
2022-10-28 12:04:00,E-Autos in der Bredouille: Zulieferer schlagen Alarm,"Verbrenner sind Geschichte, E-Autos die Zukunft. Darauf stellen sich immer mehr Hersteller ein, auch die EU will es so. Doch ganz so einfach ist das alles nicht. Zwei der größten Automobilzulieferer sehen große Probleme für den Erfolg von Elektroautos kommen. Damit sind sie nicht alleine."
2022-10-28 11:59:00,Fußball live 1. FC Slovacko – 1. FC Köln im Live-Stream & TV heute: Wo sieht man die Übertragung?,Gestern wurde das Köln-Spiel in der Conference League nach 7 Minuten unterbrochen. Heute wird der Rest nachgeholt. Ihr könnt die Übertragung des Spiels zwischen dem 1. FC Köln und 1. FC Slovacko im Live-Stream bei RTL+ einschalten. Los geht es um 13 Uhr.
2022-10-28 11:54:00,Call of Duty: Modern Warfare 2 – Disc-Version stellt euch vor ein riesiges Problem,"Das nächste Call of Duty ist da. Der neuste Teil der Shooter-Reihe mit dem Namen Modern Warfare 2 wird dabei komplett digital, aber auch traditionell auf einer Disc verkauft. Um einen gewaltigen Download kommt ihr aber in beiden Fällen nicht herum."
2022-10-28 11:29:00,Nothing Ear Stick ausprobiert: Durchsichtiger Fashion-Kopfhörer,"Die Flut an True-Wireless-Kopfhörern reisst einfach nicht ab. Wie soll sich da ein neues Modell überhaupt noch von der Masse abheben? Die Marke Nothing hat den Dreh vielleicht raus – im wahrsten Sinne des Wortes, wie unser Hands-On zeigt."
2022-10-28 10:59:00,„John Wick“-Reihenfolge: So schaut ihr die Action-Reihe richtig,"Die „John Wick“-Reihe zeichnet sich durch harte Action und einen coolen Keanu Reeves aus. Wir verraten euch, in welcher Reihenfolge ihr die Filme schauen solltet."
2022-10-28 09:36:00,7 Gratis-Games: Amazon verschenkt Fallout: New Vegas & weitere Highlights,"Im November spendiert euch Amazon gleich 7 neue Gratis-Games – darunter auch das RPG-Highlight Fallout: New Vegas. Wir zeigen euch hier, worauf ihr euch diesen Monat bei Prime Gaming freuen könnt."
2022-10-28 09:34:00,Galaxy S23 Ultra: Samsung erreicht bei der Kamera komplett neues Level,Samsung wird in einigen Monaten das Galaxy S23 Ultra als neues Flaggschiff-Smartphone vorstellen. Dort soll eine komplett neue 200-MP-Kamera zum Einsatz kommen. Bisher waren die Erwartungen an die Bildqualität eher gedämpft. Tatsächlich soll die Kamera des Galaxy S23 Ultra aber sehr gut werden.
2022-10-28 09:34:00,EU-Entscheidung gefallen: Verbrenner-Aus kommt 2035 – doch es gibt einen Haken,"Das Verbrenner-Aus in der EU ab 2035 steht. Darauf haben sich Parlament und die Mitgliedsstaaten geeinigt, nachdem zuvor die EU-Kommission den Plan gefasst hatte. Von dem Jahr an sollen demnach nur noch emissionsfreie Autos innerhalb der EU verkauft werden können. Doch es gibt ein Schlupfloch."
2022-10-28 09:03:00,iPad 2022 ausgebremst: Weitere fiese Beschränkung Apples aufgedeckt,"Das neue iPad der 10. Generation des Jahrgangs 2022 steht erneut in der Kritik. Nicht nur ist es viel teurer als der Vorgänger, auch wird das Tablet offensichtlich bewusst bei den Features beschnitten. Jetzt wird bekannt: Apple hat noch eine weitere Beschränkung verbaut, die der Hersteller bisher verschweigt – richtig fies."
2022-10-28 08:48:00,Redmi Note 12 vorgestellt: Günstiges Xiaomi-Handy der Superlative,"Xiaomi hat heute die Redmi-Note-12-Smartphones offiziell vorgestellt und dort tatsächlich Funktionen integriert, die nicht einmal die teuren High-End-Smartphones besitzen. Das Redmi Note 12 Discovery Edition stellt dabei die Speerspitze mit der 210-Watt-Schnellladefunktion dar."
2022-10-27 18:15:00,Samsung-Handys: So einfach bekommt ihr Speicherplatz zurück,"Samsung hat vor einiger Zeit eine neue Funktion eingeführt, die euch zwar mehr Arbeitsspeicher zur Verfügung stellt, gleichzeitig aber Speicherplatz kostet. Dieses Feature wurde immer wieder ausgebaut, bekommt jetzt aber eine wichtige Eigenschaft spendiert, die eigentlich von Beginn an schon hätte da sein müssen."
2022-10-27 16:40:00,Rundfunkbeitrag geprellt? Beitragsservice nimmt Gratis-Gucker ins Visier,"Ob man will oder nicht: Der Rundfunkbeitrag ist Pflicht in Deutschland. 18,36 Euro müssen Haushalte pro Monat für ARD, ZDF und Deutschlandradio zahlen. Einige entziehen sich aber der Finanzierung und gucken schwarz. Das will der Beitragsservice nicht hinnehmen und tut sich deshalb mit dem Einwohnermeldeamt zusammen."
2022-10-27 16:30:00,Samsung mit Problemen: So ein schlechtes Ergebnis gab es lange nicht,Selbst bei Samsung läuft es nicht mehr so richtig: Erstmals seit drei Jahren hat der Konzern weniger Gewinn gemacht. Den schwachen PC- und Speicher-Markt bekommt Samsung deutlich zu spüren – doch Smartphones verkaufen sich trotzdem bestens.
2022-10-27 15:20:00,"Bei iPhone, iPad und Co richtig sparen: Restposten so attraktiv wie nie zuvor","Apples neue Produkte werden von Mal zu Mal teurer. Dies liegt aber nicht an der Gier des Herstellers, vielmehr macht uns die eigene Währung derzeit einen Strich durch die Rechnung. Wer da bei iPhone, iPad und Co. richtig sparen will, muss klug sein und unter anderem zu Restposten greifen."
2022-10-27 15:00:00,Huawei Mate 50 Pro im Hands-On-Video: Teures Kamera-Smartphone für Deutschland,Huawei bringt das Mate 50 Pro als neues High-End-Smartphone nach Deutschland. Nach der Vorstellung im September in China kommt das Handy bald zu uns. Der Preis fällt ziemlich hoch aus und ihr müsst auch auf einige Funktionen verzichten. Dafür bekommt ihr aber auch ein Google-freies Android-Handy mit starker Kamera. Wir konnten uns einen ersten Eindruck verschaffen.
2022-10-27 14:59:00,Heizung bleibt aus: Die Deutschen frieren für den Kontostand,"Heizen ist in Deutschland derzeit so teuer wie nie, doch die kalten Monate kommen immer näher. Da ist es kein Wunder, dass viele Menschen sparen wollen und die Heizung eher noch abgestellt lassen. Dabei gibt es aber klare Unterschiede in der Sparbereitschaft."
2022-10-27 14:38:00,PS Plus Essential: Das sind die kostenlosen November-Spiele,"Sony hat drei neue Spiele angekündigt, die ab dem 1. November über das PS-Plus-Essential-Abo kostenlos zu haben sind. Um welche Games es sich hierbei handelt und wo ihr sie bekommt, erfahrt ihr in unserer Übersicht."
2022-10-27 14:30:00,Volkswagen denkt um: Neue Namen sollen E-Auto-Kunden helfen,"Volkswagen-Chef Thomas Schäfer findet, dass sich die eigene Produktpalette „hier und da überschneidet“. Nun soll für mehr Klarheit gesorgt werden, was die Bezeichnungen der Autos angeht. Der Buchstabe X spielt dabei eine große Rolle – und die Zukunft von Golf und Polo ist ungewiss."
2022-10-27 14:00:00,Vodafone-Störung – hier gibt es heute Probleme,"Durch Umbauarbeiten und technische Probleme kommt es bei Vodafone auch heute zu Störungen. GIGA hält die Probleme im Blick und erklärt, warum ein aktuelles „Vodafone-Down“ euch betreffen kann und welche Dienste Störungen haben."
2022-10-27 13:30:00,Apple stichelt gegen Facebook: Metaverse ist ein verbotenes Wort,"Obwohl Apple eigene VR-Ziele verfolgt, möchte man sich mit Facebooks Metaverse nicht anfreunden. Jetzt hat sich der Marketing-Vizepräsident von Apple abwertend geäußert. Metaverse sei ein Wort, dass er niemals benutzten würde. Zuvor hatte bereits Tim Cook gegen Facebook gestichelt."
2022-10-27 12:30:00,Neue Angebote bei Aldi: Ab heute (27.10.) lockt wieder das Sonderregal,"Bei Aldi gibt es ab heute, den 27. Oktober, wieder einige neue Angebote. In den Filialen des Discounters, aber auch im Online-Shop lohnt sich das Vorbeischauen. In der Übersicht zeigen wir, welche der Angebote sich lohnen."
2022-10-27 12:28:00,Ab heute (27.10.) bei Lidl: Starke Rabatte beim Discounter,"Lidl lockt ab heute, den 27. Oktober, wieder in die Filialen und in den Online-Shop. Welche der neuen Angebote sich wirklich lohnen, klären wir in unserer Übersicht."
2022-10-27 12:14:00,Xbox-Chef kündigt Preiserhöhung an: Gamer müssen tiefer in die Tasche greifen,Für preisbewusste Konsolen-Gamer ist die Xbox die erste Wahl. Im Gegensatz zu Sony hat Microsoft die Preise für Series X und Series S nicht angehoben und der Game Pass bietet für kleines Geld eine riesige Auswahl an Spielen. Die Tage des günstigen Game-Vergnügens sind aber auch bei der Xbox gezählt.
2022-10-27 11:42:00,VW drückt auf die Tube: Verbrenner-Aus kommt früher als gedacht,"VW macht Ernst: Statt wie bisher angekündigt, ab 2035 keine Autos mit Verbrennungsmotor mehr in Europa anbieten zu wollen, gibt es jetzt ein neues Datum. Volkswagen wird jedoch nicht nur das Aus für den Verbrenner deutlich vorziehen, sondern setzt sich auch neue Ziele für die Produktion und Entwicklung neuer E-Autos."
2022-10-27 11:35:00,AirPods belauschen iPhone-Nutzer: Was ihr jetzt sofort tun müsst,"Ein aktuelles Sicherheitsrisiko fürs iPhone erfordert von Nutzerinnen und Nutzern jetzt schnelles Handeln. Wie nämlich bekannt wird, könnten andernfalls Apples AirPods einfach ungefragt mithören und die Anwender so belauschen."
2022-10-27 10:43:00,Galaxy S22: Samsung macht die Kamera des Top-Handys noch besser,"Samsung hat die Galaxy-S22-Smartphones zwar vor einigen Monaten auf den Markt gebracht, doch das hindert das Unternehmen nicht daran, die Smartphones mit neuen Funktionen aufzurüsten. Dieses Mal geht es um die Kamera und neue Möglichkeiten durch zwei zusätzliche Apps."
2022-10-27 09:45:00,Günstiges E-Auto: VW geht den Mittelweg,"VW hält am Plan fest, ein erschwingliches E-Auto zu bauen. Jetzt hat Markenchef Thomas Schäfer bekräftigt, was der Volksstromer voraussichtlich kosten wird. Doch bei nur einem günstigen Elektroauto soll es nicht bleiben."
2022-10-27 09:01:00,So ein iPad gab es noch nie: Apple arbeitet an übergroßer Überraschung,"Beim iPad offeriert Apple unterschiedliche Bildschirmgrößen. Los geht’s aktuell mit dem iPad mini und 8,3 Zoll. Doch spätestens beim iPad Pro und einem Display von 12,9 Zoll ist Schluss. Ändern soll sich dies in greifbarer Zukunft, denn Apple plant im wahrsten Sinne des Wortes eine übergroße Überraschung."
2022-10-27 08:32:00,Samsung legt los: Brandneues Software-Update wird viel früher für erstes Handy verteilt,"Samsung ist zwar bekannt für seine Schnelligkeit bei Software-Updates, doch dieses Mal hat sich das Unternehmen selbst übertroffen. Obwohl der November noch nicht einmal angefangen hat, bekommt das erste Galaxy-Smartphone schon die neue Software spendiert. Weitere Modelle dürften sehr schnell folgen."
2022-10-27 07:00:00,Handyverträge unter 10 Euro im Monat:  Aktuelle Angebote im Vergleich,"Gute Handyverträge, mit viel LTE-Datenvolumen sowie der Möglichkeit, unbegrenzt zu telefonieren und SMS zu schreiben, gibt es mittlerweile für unter 10 Euro im Monat. Wir haben uns alle verfügbaren Angebote angesehen und die besten für euch übersichtlich zusammengefasst."
2022-10-27 06:55:00,Aldi führt Versandkosten ein: So viel teurer macht das den Onlineshop,"Aldi Nord und Aldi Süd sind längst nicht mehr nur beliebte Lebensmittel-Discounter. Gerade online werdet ihr auch bei allerlei Geräten fündig, vom Haushalt über Technik wie TVs und Smartphones bis zu Möbeln oder Equipment für den Garten. Doch dafür müsst ihr ab sofort tiefer in die Tasche greifen."
2022-10-26 18:15:00,Ausgaben im Blick: Diese kostenlose App darf auf eurem Handy nicht fehlen,"Steigende Lebenshaltungskosten und die hohe Inflation sorgen in Deutschland dafür, dass viele Menschen deutlich mehr aufs Geld achten müssen. Davon sind auch Menschen betroffen, die eigentlich genug verdienen, durch die steigenden Kosten aber doch nicht mehr so unbeschwert leben können. Kostenlose Apps können euch beim Umgang mit eurem Geld und den Ausgaben helfen."
2022-10-26 18:01:00,Sony-Kopfhörer bekommen eine nützliche Funktion per Update nachgereicht,"Neben Klang, Design, Bedienung und Tragekomfort gibt es ein wichtiges Merkmal, das Kopfhörer deutlich aufwertet. Sony wird es ab November für ausgewählte Modelle per Firmware-Update nachliefern."
2022-10-26 17:30:00,PlayStation 5 mit God of War Ragnarök: Dieses Bundle ergibt Sinn,"Sony hat ein neues Bundle angekündigt, bei dem neben der PlayStation 5 noch das Spiel God of War Ragnarök mit im Paket liegt. Erstmals steht damit die PS5 flächendeckend in der neuen Hardware-Version bereit, die weniger auf die Waage bringt."
2022-10-26 16:48:00,Deutsche Autofahrer atmen auf: Langfinger so schlecht wie nie,"Nichtsahnend kommt man zum Parkplatz und sieht: nichts. Wenn das Auto geklaut wurde, bricht für viele Fahrzeugbesitzer eine Welt zusammen. Neben Versicherungsärger befindet sich im Pkw oft auch Persönliches, das für immer verloren ist. Umso erfreulicher, wenn dieser Alptraum immer seltener wird. Die neueste Statistik zu den Autodiebstählen in Deutschland unterschreitet sogar eine magische Grenze."
